{
  "schema_version": "1.0",
  "lesson_id": "lsn-john-04-eternal-life",
  "series_id": "ser-gospel-of-john",
  "order": 4,
  "title": "What Is Required for Eternal Life?",
  "source_language": "en",
  "translation_status": "draft",
  "source_attribution": null,
  "rights_note": null,
  "primary_gospel_event_id": "r1922-179",
  "related_gospel_event_ids": [
    "r1922-150",
    "r1922-151",
    "r1922-152",
    "r1922-153",
    "r1922-154",
    "r1922-155",
    "r1922-156",
    "r1922-159",
    "r1922-161",
    "r1922-163",
    "r1922-164",
    "r1922-165",
    "r1922-167",
    "r1922-171",
    "r1922-172",
    "r1922-173",
    "r1922-178",
    "r1922-180"
  ],
  "phase": null,
  "sub_phase": null,
  "phase_mapping_status": "pending",
  "scripture_reference": [
    {
      "book": "John",
      "chapter_start": 16,
      "verse_start": null,
      "chapter_end": 21,
      "verse_end": null,
      "display": "John 16-21",
      "deep_link": null
    }
  ],
  "teaching": "This week, read John 16-21 in your own Bible. As you read, watch how John answers the question: What is required for eternal life? Look for the work of the Spirit, the prayer of Jesus, the cross, the resurrection, the response of Thomas, and the restoration of Peter.\n\nThe anchor passage is John 20:26-31. Near the end of the Gospel, John tells readers why he wrote: so that they may believe Jesus is the Christ, the Son of God, and have life in his name. Eternal life is not earned by religious effort, family background, moral improvement, or perfect understanding. It is received by believing in Jesus as he is revealed.\n\nJohn 16 shows that the Spirit exposes sin, righteousness, and judgment, and guides Jesus' followers into truth. John 17 shows Jesus praying for those the Father has given him. John 18-19 shows Jesus rejected, tried, crucified, and buried. John presents the cross not as an accident, but as the place where Jesus completes the work given to him.\n\nThen John 20 turns from death to witness. Mary Magdalene, the disciples, and Thomas encounter the risen Jesus. Thomas moves from doubt to confession, not because he solved every mystery, but because he met the risen Lord. John 21 then shows that failure is not the end for those who belong to Jesus. Peter is restored and called again to follow.\n\nAs you read, ask: What does John invite me to believe about Jesus, and what would it mean to entrust myself to him?",
  "outside_the_box": "In John, eternal life is not only endless existence after death. It is life that comes from knowing God through Jesus. That life begins now and continues beyond death. This helps us avoid two mistakes. We do not reduce salvation to a future destination only. We also do not reduce it to present spiritual improvement. Eternal life is personal, relational, and centered on the crucified and risen Son.",
  "reflection_questions": [
    {
      "id": "q01",
      "text": "In John 16-21, what does Jesus accomplish that people could never accomplish for themselves?"
    },
    {
      "id": "q02",
      "text": "What do you notice about the different responses to the risen Jesus in John 20?"
    },
    {
      "id": "q03",
      "text": "How does Peter's restoration in John 21 help you understand grace after failure?"
    },
    {
      "id": "q04",
      "text": "What is the difference between knowing facts about Jesus and believing in Jesus?"
    }
  ],
  "live_it_out": "This week, write a simple personal response to Jesus. Use three headings: *What I see*, *What I believe*, and *What I still struggle with*. Be honest. Bring one sentence from your response to the final huddle meeting.",
  "prayer_prompt": "Ask the risen Jesus to lead you from observation to trust. Thank him for completing the work of salvation and ask for grace to follow him honestly, even with remaining questions.",
  "huddle_discussion_prompts": [
    {
      "id": "p01",
      "text": "Begin by inviting each person to share one scene from John 16-21 that felt most important to them."
    },
    {
      "id": "p02",
      "text": "Discuss q04. Help the group distinguish mere agreement, emotional pressure, and genuine trust in Jesus."
    },
    {
      "id": "p03",
      "text": "Invite participants to share from q03. How does Jesus deal with failure in John 21?"
    },
    {
      "id": "p04",
      "text": "Close the series by inviting each person to share one sentence from the live_it_out practice, without forcing anyone to say more than they are ready to say."
    }
  ],
  "leader_notes": "This final lesson may bring people to a point of decision, but do not manipulate the moment. John's own purpose is clear: readers are invited to believe and have life in Jesus. Explain faith as personal trust in the crucified and risen Christ, not as perfect knowledge or a religious performance. Be ready for a range of responses: joyful faith, cautious openness, honest doubt, or quiet resistance. Honor honesty while clearly naming the invitation. Peter's restoration can help those ashamed of failure. End with prayer and, if appropriate, offer follow-up conversation for anyone who wants to respond to Jesus more personally."
}