{
  "schema_version": "1.0",
  "lesson_id": "lsn-john-02-judgment",
  "series_id": "ser-gospel-of-john",
  "order": 2,
  "title": "Do Non-Believers Really Deserve Hell?",
  "source_language": "en",
  "translation_status": "draft",
  "source_attribution": null,
  "rights_note": null,
  "primary_gospel_event_id": "r1922-099",
  "related_gospel_event_ids": [
    "r1922-072",
    "r1922-073",
    "r1922-074",
    "r1922-076",
    "r1922-077",
    "r1922-094",
    "r1922-095",
    "r1922-096",
    "r1922-097",
    "r1922-098",
    "r1922-100",
    "r1922-101",
    "r1922-111",
    "r1922-112"
  ],
  "phase": null,
  "sub_phase": null,
  "phase_mapping_status": "pending",
  "scripture_reference": [
    {
      "book": "John",
      "chapter_start": 6,
      "verse_start": null,
      "chapter_end": 10,
      "verse_end": null,
      "display": "John 6-10",
      "deep_link": null
    }
  ],
  "teaching": "This week, read John 6-10 in your own Bible. As you read, watch how Jesus describes the human problem. The question is painful: Do non-believers really deserve hell? Let John lead you slowly. Notice that Jesus does not begin with cold punishment. He begins by offering life, bread, light, freedom, sight, and shepherding care.\n\nThe anchor passage is John 8:21-59. In this confrontation, Jesus speaks about dying in sin, being enslaved, rejecting truth, and needing to believe who he is. This is not a picture of morally neutral people being punished for a minor mistake. It is a picture of people standing before the Light and refusing him.\n\nJohn 6-10 shows the same pattern in several ways. Crowds want bread but stumble over Jesus himself. Religious leaders debate his identity while resisting his words. Some claim spiritual confidence while remaining blind to their own need. In John 9, a man born blind receives sight, while those who are sure they see are exposed as spiritually blind. In John 10, Jesus speaks as the Shepherd who knows, calls, protects, and lays down his life for the sheep.\n\nSo the question of judgment must be held together with the heart of Jesus. He warns because sin is real. He speaks of judgment because unbelief is not harmless. But he also comes to rescue, gather, heal, and give life.\n\nAs you read, ask: What does Jesus say we need to be saved from, and what does he offer in himself?",
  "outside_the_box": "In John's Gospel, unbelief is more than lack of information. Many people see signs, hear teaching, and still resist Jesus. John often presents judgment as exposure: light reveals what was already there. This matters pastorally. Hell is not presented as God losing patience with sincere seekers. It is the final seriousness of rejecting the life and truth God gives in his Son. That makes the warning sobering, but it also makes the invitation urgent and merciful.",
  "reflection_questions": [
    {
      "id": "q01",
      "text": "In John 6-10, where do you see Jesus offering life, mercy, or rescue before speaking words of warning?"
    },
    {
      "id": "q02",
      "text": "What descriptions of the human problem appear in this reading: hunger, slavery, blindness, false shepherding, unbelief, or something else?"
    },
    {
      "id": "q03",
      "text": "Why might people resist Jesus even when they hear his words or see his works?"
    },
    {
      "id": "q04",
      "text": "How does this reading affect the way you think about people you love who do not believe?"
    }
  ],
  "live_it_out": "This week, write down the names of two people you care about who do not yet trust Jesus. Pray for them daily. Ask God to give you compassion without fear, truth without harshness, and readiness for one honest conversation.",
  "prayer_prompt": "Ask Jesus to help you feel both the seriousness of judgment and the tenderness of his saving heart. Pray for people you love by name, asking the Shepherd to call them to himself.",
  "huddle_discussion_prompts": [
    {
      "id": "p01",
      "text": "Open gently. Acknowledge that this week's question may touch grief, family history, or fear. Give people permission to speak carefully and not perform certainty."
    },
    {
      "id": "p02",
      "text": "Invite participants to share from q01. Where did they see Jesus leading with mercy, invitation, or rescue?"
    },
    {
      "id": "p03",
      "text": "Discuss q02 and q03 together. What does John show about the depth of the human problem?"
    },
    {
      "id": "p04",
      "text": "Use q04 to move toward prayer. Ask the group how this passage can create compassion rather than superiority."
    }
  ],
  "leader_notes": "Handle this lesson with extra pastoral care. Some participants may immediately think of deceased parents, grandparents, friends, or people from another religious background. Do not speculate about specific eternal destinies. Keep the group anchored in what Jesus says in John 6-10: sin is serious, unbelief matters, and Jesus comes as the life-giving Shepherd. Avoid a combative tone. The goal is not to win an argument about hell, but to let Jesus define the danger and display his mercy. If emotions rise, slow down and pray. Preview next week by noting that John 11-15 will focus on Jesus' exclusive claim to bring people to the Father."
}